ID,resumen,link,createdAt,createdBy,modifiedAt,modifiedBy
1e7477ff-6846-42c1-9f62-f8e072962dce,"De acuerdo con la sesión de cadencia del 29 de junio, el proyecto ha avanzado en la entrega de disponibilidad de datos sobre rentabilidad; sin embargo, los datos que siguen siendo riesgosos corresponden a tesorería para avanzar en el modelo FTP. A nivel de performance, el Partner valida el Sizing y las pruebas que pueda requerir para la liberación de los modelos. El Banco ha entregado el 92% de los datos, presentando pendientes relacionadas con tesorería debido al proveedor de servicios, lo que detiene el progreso del modelo FTP. Las pruebas UAT para costos y rentabilidad han tenido ajustes, pero no afectan el Go Live planeado. A nivel de performance, se identificaron problemas vinculados al consumo de recursos en la ejecución de los modelos, mientras que se revisa la estrategia de pruebas de estrés y volumen, se recomienda al Partner hacer validaciones de la optimización de los modelos, no solo considerando las recomendaciones del procesador de SAC (Issue abierto) sino, también compartir su propuesta con el SAP CSP BTP. Actualmente se está terminando el despliegue de los programas de lectura con DataSphere y la desencriptación requerida. De otro lado, se planifican las fases de realización y cutover, proyectando los Go Live de producción (Costos y Rentabilidad) para el mes de Julio, FTP para agosto y ALM empezaría su implementación en septiembre 2025 por dependencia de definiciones e identificación de procesos de cálculos por parte del Banco. Los QGates han sido diligenciados hasta la fase de realización. Se identifican varios issues abiertos relacionados con performance, disponibilidad de datos y gestión manual de modelos en productivo. La Customer Office recomienda al Partner entregar al Cliente un informe de referencia en donde brinde claridad de la situación de performance presentada frente a los cálculos considerando el Sizing y la volumetría inicial versus la volumetría actual y el modelamiento en optimización. Adicionalmente, se solicita contar con el cronograma vigente del proyecto, pues no resulta una buena práctica de gestión estar en un proyecto sin trazabilidad.",https://sico.docs/actas/ACT-0001.pdf,,,,
9ee26226-fa3d-4347-a00a-f47dfa5595ef,"La sesión realizada el 2 de julio de 2025, convocada por la Customer Office, contó con la participación de los equipos de SAP e informa que la sesión convocada por el SAP EA con GEB, con el propósito de presentar el DEMO de la solución de sostenibilidad de acuerdo con su solicitud, no se realizó ni hay intenciones del Cliente de realizarla. El proyecto continúa detenido desde el 23 de diciembre de 2024. A pesar de algunos acercamientos de SAP con GEB sobre otros servicios, el proyecto de sostenibilidad no ha sido discutido y se necesita definir la estrategia comercial para abordarlo. El proyecto está estancado en la Fase 1, llevando a MSG a gestionar la dedicación de los recursos y enfrentar riesgos críticos y abiertos, como la falta de claridad en el diseño arquitectónico y la falta de decisión del Cliente sobre la continuidad del proyecto, que impide desarrollar propuestas desde SAP. Las insatisfacciones de GEB en fases pasadas y la última versión del SCT Universal Model también han afectado la viabilidad del proyecto. Ante la falta de avance, la Customer Office planea cancelar el PCCP. De otro lado, Horacio Seeber buscará un acercamiento comercial con GEB durante su visita a Bogotá el 15 de julio de 2025.",https://sico.docs/actas/ACT-0002.pdf,,,,
a1ac8371-2079-4927-af6d-ece8d9eb800a,"El gerente del proyecto del Cliente no asistió a la sesión programada por la Customer Office para establecer la fecha de reinicio del PCCP, y tampoco participó en la reunión de seguimiento del 27 de mayo de 2025. Esto llevó a la Customer Office a organizar una reunión de emergencia con SAP y el Partner para abordar la situación crítica del proyecto y desarrollar un plan de remediación. Con una desviación de tres meses en la fase de exploración, el Cliente expresó preocupaciones sobre la salida en PRD y la falta de conocimiento del Partner en retail y productos SAP. En respuesta, el Partner compromete la asignación de consultores especializados en TRM y Retail. Sin embargo, el proyecto enfrenta riesgos críticos, como la no disponibilidad del SAP GTM para geolocalización en Venezuela, impidiendo una solución estándar. La falta de liderazgo del Partner comprometió la entrega de valor, lo que podría afectar la salida en PRD programada para el 1 de octubre de 2025. Desde la Customer Office se enviará un correo al equipo interno SAP de la cuenta alertando sobre la posibilidad de retiro del proyecto del programa PCC ante la nula participación, tracción y asistencia evidenciada tanto por el Cliente como por el Partner, durante las últimas 4 semanas (inicio de junio 2025). Desde la Customer Office se compartió al Cliente (Romeo Najm) la WebSurvey de junio 2025, sin embargo, a pesar del envió de la misma en marzo 2025, no se recibió respuesta por parte del Cliente. Aún se espera que el AE anterior (Salvatore Cherchi) comparta la carta de aceptación de condiciones del PCCP firmada.",https://sico.docs/actas/ACT-0003.pdf,,,,
02d738b5-e65e-4382-9c3b-6a7f34e3dcba,"En la sesión del PCCP del 2 de julio de 2025, se revisó el estado del proyecto, destacando una discrepancia del 4% con respecto a lo planeado, principalmente en la configuración y API's. CSTI y BOLD examinan necesidades de capacidad transaccional, con proyecciones de facturación que ahora alcanzan 500,000 al mes, requiriendo ajustes que evalúan ambas partes (Cliente y Partner). El cronograma presenta retrasos en la integración y configuración de datos, con desarrollos y pruebas UAT programadas para iniciar el 1 de agosto de 2025 y se requiere cerrar la estructura de centros de costos, junto a aspectos de localización. CSTI y BOLD actualmente están comprometidos con la gestión y alineación de datos maestros y saldos financieros. No se presentan novedades a nivel de recursos relacionados con el equipo del proyecto. Se considera un nuevo requerimiento de conectividad entre Google Authenticator y SAP, sobre el cual CSTI adelanta como propuestas su implementación o el entrenamiento del Cliente para que lo realice directamente. Se avanza en la planificación de pruebas UAT, volumen y estrés, junto con la necesidad de definir un plan de Go Live. Sin embargo, hay riesgos abiertos relacionados con integraciones, infraestructura y desarrollos, que podrían impactar negativamente el cronograma. La Customer Office recomienda al AE gestionar las necesidades de formación de BOLD para fortalecer su conocimiento en buenas prácticas de adopción de GROW e integrar al equipo de Educación de SAP en este proceso para optimizar el uso de soluciones y gestionar efectivamente las necesidades en el proyecto y futura operación. Las gerencias de proyecto deben actualizar los QGates, la matriz de stakeholders y el cronograma, asegurando así una gestión adecuada.",https://sico.docs/actas/ACT-0004.pdf,,,,
68d6a991-6647-40f7-953b-648c2d577df8,"El proyecto de conversión de ECC a S/4 HANA avanza con un 37% de progreso general, aunque presenta retrasos menores en la revisión de transacciones y validación de guiones de pruebas del primer ciclo. Este proyecto se lleva a cabo junto con otros tres proyectos del Cliente: Vistex, SAP Analytics Cloud y SAP BPC, que están alineados con la salida en productivo de S/4 HANA. Las gerencias del proyecto determinan para el Go Live un primer release (BPC para el 30 de junio de 2025) que incluirá junto a la conversión, los estados financieros y planning de BPC (reportes de operación BO BI, SAP Analytics SAC) y se hará un segundo release para la inclusión de presupuesto y el resto del alcance (16 de septiembre de 2025). El Partner ha completado ajustes en todos los objetos Z (El proceso de conversión no incluyó optimizaciones Fiori ni BTP) y prepara un plan de pruebas de estrés para S/4 HANA que implicará 500 usuarios. Por otro lado, la documentación del proyecto formal se adelantará en ALM y los entregables de la fase están al día. V. Suarez evaluará la necesidad de formación formal. Los riesgos implican el manejo de la transferencia de conocimiento al equipo funcional. Finalmente, la Customer Office coordinará seguimientos quincenales con las gerencias del proyecto para mantener el proyecto encaminado.",https://sico.docs/actas/ACT-0005.pdf,,,,
c23ff413-4678-42e4-b98c-0d1129575d61,"En la sesión de seguimiento del 1 de julio, se reportó un atraso de un mes en la fase de exploración del proyecto, lo que podría impactar la salida en vivo, pendiente de confirmación por parte del Cliente. Con un 16% del proyecto ejecutado frente al 22% planificado, la fase de exploración alcanza sólo el 28% de completitud comparado con el 32% previsto. Solo se entregó el QGate de Clean Core debido al desconocimiento del Partner, dejando pendientes otros QGates de metodología. Avances en ciberseguridad se registraron en Cuernavaca tras la intervención de un experto suministrado por SAP. Adicionalmente, el Cliente solicitó asesoría a SAP a través de la Customer Office para utilizar Joule en RISE. Los retrasos en definiciones de BPD contribuyeron a la desviación en el proyecto. Los riesgos abiertos incluyen el uso incorrecto de la metodología SAP Activate por parte del proyecto, conocimiento insuficiente del Partner sobre Fiori’s y agentes IA y su impacto en calidad y valor de la solución. La Customer Office contactará el 8 de julio al responsable de IA Joule para RISE (Gabriel Gomez) y garantizar la adecuada orientación al Cliente.",https://sico.docs/actas/ACT-0006.pdf,,,,
000ea955-3d57-40cf-bc7f-285ea75c8fd0,"En la sesión del 19 de mayo entre la Customer Office y el equipo interno de SAP, se abordó la escalación asociada con el proyecto de implementación HCM con el Partner Softtek. Posteriormente, el 25 de junio el equipo de SAP PES se reunió con el Partner que indicó no haber recibido comunicación sobre el escalamiento del Assessment previamente, sin embargo, Softtek (Nestor) sugiere incluir al Gerente General del Partner en Colombia (Luis Martínez) en las negociaciones para resolver esta escalación constructivamente. De acuerdo con lo informado por el Partner a SAP PES, las dificultades en las relaciones con el Cliente incluyen un cambio extremo en el alcance, de una a nueve empresas, mala comunicación entre líderes y resistencia en el equipo de Softtek debido a presuntos malos tratos por parte del Cliente. A pesar de la contratación de un nuevo PM por MQA, el proyecto requiere replantearse, especialmente la fase de realización. La salida en productivo se confirma en dos fases, y Softtek debía comunicar un nuevo cronograma el 26 de mayo. El proyecto enfrenta riesgos críticos como inexperiencia de Softtek en HCM, inestabilidad del plan de proyecto y procesos de negocio de nómina inestables. La Customer Office recomienda no abandonar la ejecución del Assessment de SAP, así como, asegurar por parte de Softtek consultores capacitados, actualizar el cronograma y matriz de riesgos (avalados por el Cliente). Finalmente, no se contemplan concesiones por parte de SAP.",https://sico.docs/actas/ACT-0007.pdf,,,,
ba3bf4ca-e10e-4705-97b7-672e45172641,"En la sesión del 2 de julio de 2025, el Cliente expresó preocupaciones sobre los retrasos en el proyecto y la suscripción que sigue pagando sin estar en producción por más de 1 año. La salida en vivo se ha pospuesto, con soluciones proyectadas para enero de 2026 y despliegue extendido hasta marzo de 2026. Problemas como la lentitud en la carga de datos para Hojas de Ruta y la falta de comunicación efectiva han afectado el avance. Adicionalmente, los cambios en el proyecto requieren ajustes en el cronograma, lo cual aumentará el costo financiero del mismo. Se necesitan mejoras en la gobernabilidad y metodología del proyecto. Los riesgos incluyen aspectos críticos en las pruebas, solicitudes adicionales por parte del Cliente para LETRA y una solución para cubrir la necesidad del proceso de Precursores. La línea de tiempo del proyecto se ha duplicado, reflejándose una corresponsabilidad del Cliente y el Partner en la desviación. Las acciones sugeridas desde la Customer Office incluyen una mayor claridad en la gestión por parte del equipo de proyecto, así como la potencial ayuda de SAP para abordar las deficiencias identificadas.",https://sico.docs/actas/ACT-0008.pdf,,,,
